{
  "schemaVersion": "1.0.0",
  "kind": "tool-policy",
  "id": "specialist-video-analysis-tools",
  "version": "0.1.0",
  "tools": [
    "get_match",
    "find_counter_attacks",
    "find_turnovers",
    "get_heatmap",
    "find_ball_actions",
    "find_set_plays",
    "get_formations",
    "find_pressing_phases",
    "get_tactical_phases",
    "get_video_clip"
  ]
}
